"event_id","user_id","role","content","name","timestamp","conversation_id"
"6940","46","assistant","È importante avere uno spazio dove potersi decomprimere quando ci si sente sovrastimolati. Ecco alcuni suggerimenti su come potresti gestire questa necessità:

- **Parla con le Risorse Umane**: Informa il dipartimento delle risorse umane delle tue esigenze. Potrebbero essere in grado di aiutarti a trovare uno spazio tranquillo dove puoi andare quando hai bisogno di decomprimere.

- **Identifica uno spazio tranquillo**: Se possibile, individua un'area dell'ufficio che sia meno frequentata e più silenziosa, dove puoi ritirarti temporaneamente.

- **Accordi con il tuo supervisore**: Discuti con il tuo supervisore la possibilità di prendere brevi pause quando necessario per gestire la sovrastimolazione.

- **Utilizza strumenti di riduzione del rumore**: Considera l'uso di cuffie con cancellazione del rumore o tappi per le orecchie per aiutarti a gestire l'ambiente quando non puoi lasciare immediatamente la tua postazione.

- **Crea un piano personale**: Sviluppa un piano personale per gestire la sovrastimolazione, che includa tecniche di rilassamento o esercizi di respirazione che puoi fare al bisogno.

Questi passi possono aiutarti a gestire meglio la sovrastimolazione e a mantenere il tuo benessere sul lavoro.","assistant","2025-12-17 14:40:20.414","238"
"6939","46","user","Sono autistico e talvolta ho bisogno di uno spazio per decomprimere quando sono sovrastimolato, cosa posso fare?","foo.presales@testing.org","2025-12-17 14:40:01.150","238"
"6938","46","assistant","Se senti che la tua neurodivergenza potrebbe influenzare le opportunità di avanzamento, ecco alcuni passi che potresti considerare:

- **Valuta le tue prestazioni**: Assicurati di avere una chiara comprensione delle aspettative del tuo ruolo e di come le tue prestazioni si allineano a queste. Chiedi feedback regolare per identificare aree di miglioramento.

- **Comunica i tuoi obiettivi**: Parla con il tuo supervisore o il dipartimento delle risorse umane riguardo ai tuoi obiettivi di carriera e chiedi quali passi puoi intraprendere per avanzare.

- **Sviluppa nuove competenze**: Considera la possibilità di acquisire nuove competenze o certificazioni che possano renderti un candidato più forte per promozioni future.

- **Cerca un mentore**: Trova un mentore all'interno dell'azienda che possa guidarti e consigliarti su come navigare le opportunità di carriera.

- **Partecipa attivamente**: Mostra iniziativa partecipando a progetti o attività che vanno oltre il tuo ruolo attuale, dimostrando il tuo impegno e le tue capacità.

- **Chiedi supporto**: Se ritieni che la neurodivergenza stia influenzando le tue opportunità, considera di discuterne con le risorse umane per esplorare eventuali supporti o adattamenti che potrebbero essere utili.

Questi passi possono aiutarti a progredire nella tua carriera e a ottenere il riconoscimento che meriti.","assistant","2025-12-17 14:39:58.188","238"
"6937","46","user","Sono leggermente neurodivergente e nessuno mi ha mai proposto un avanzamento. Cosa posso fare?","foo.presales@testing.org","2025-12-17 14:39:49.685","238"
"6936","46","assistant","È comprensibile voler gestire le difficoltà in modo discreto, ma è importante ricordare che chiedere supporto è un passo positivo verso un ambiente di lavoro più inclusivo. Ecco alcune strategie che potresti considerare:

- **Esplora le impostazioni di accessibilità**: Molte piattaforme social offrono impostazioni di accessibilità che possono essere personalizzate per migliorare l'esperienza utente. Controlla se ci sono opzioni che possono aiutarti.

- **Formazione e risorse**: Chiedi se l'azienda offre formazione o risorse specifiche per aiutarti a utilizzare le piattaforme social in modo più efficace.

- **Supporto tecnico**: Contatta il supporto tecnico o il dipartimento IT per vedere se possono offrire soluzioni o strumenti aggiuntivi che possano facilitare l'uso delle piattaforme.

- **Feedback anonimo**: Se preferisci non rivelare le tue difficoltà, considera l'opzione di fornire feedback anonimo sulle sfide che incontri, in modo che l'azienda possa migliorare l'accessibilità per tutti.

- **Collegamento con un mentore**: Trova un collega di fiducia o un mentore che possa offrirti supporto e consigli su come navigare le piattaforme social.

Questi passi possono aiutarti a gestire le difficoltà in modo efficace, mantenendo la discrezione che desideri.","assistant","2025-12-17 14:39:38.820","238"
"6935","46","user","A causa della mia disabilità faccio fatica con le piattaforme social aziendali, ma non voglio farmi vedere in difficoltà. Cosa posso fare?","foo.presales@testing.org","2025-12-17 14:39:16.985","238"
"6934","46","assistant","Assolutamente, puoi e dovresti chiedere i sottotitoli nei meeting per garantire che tu possa partecipare pienamente e comprendere tutto ciò che viene discusso. Ecco come potresti procedere:

- **Contatta l'organizzatore del meeting**: Informa l'organizzatore del meeting delle tue esigenze e chiedi se possono attivare i sottotitoli automatici o fornire un servizio di sottotitolazione.

- **Utilizzare strumenti di sottotitolazione**: Molte piattaforme di videoconferenza offrono funzionalità di sottotitolazione automatica. Assicurati che l'organizzatore sappia come attivarle.

- **Richiedere un interprete**: Se necessario, chiedi se è possibile avere un interprete della lingua dei segni o un servizio di trascrizione in tempo reale.

- **Feedback e miglioramenti**: Dopo il meeting, fornisci feedback su come è andata la sottotitolazione e suggerisci eventuali miglioramenti.

Richiedere sottotitoli è un passo importante per garantire l'accessibilità e la tua piena partecipazione ai meeting.","assistant","2025-12-17 14:39:10.189","238"
"6933","46","user","Sono ipoudente, posso chiedere i sottotitoli nei meeting?","foo.presales@testing.org","2025-12-17 14:39:04.186","238"
"6932","46","assistant","È importante che i corsi online siano accessibili a tutti, inclusi coloro che hanno esigenze particolari. Ecco alcune alternative che potresti considerare:

- **Richiedere supporti aggiuntivi**: Chiedi se è possibile avere accesso a materiali di supporto, come trascrizioni, sottotitoli o riassunti scritti dei corsi.

- **Formati alternativi**: Verifica se i corsi sono disponibili in formati diversi, come podcast o video con diverse velocità di riproduzione, che potrebbero essere più facili da seguire.

- **Sessioni di tutoring**: Chiedi se è possibile organizzare sessioni di tutoring individuali o di gruppo per discutere i contenuti del corso in un ambiente più interattivo.

- **Accesso a un mentore**: Un mentore o un collega che ha già completato il corso potrebbe offrirti supporto e spiegazioni aggiuntive.

- **Feedback personalizzato**: Fornisci feedback al team di formazione aziendale sulle difficoltà che incontri, in modo che possano adattare i contenuti o i metodi di insegnamento.

Queste alternative possono aiutarti a ottenere il massimo dai corsi online aziendali. Non esitare a contattare il dipartimento delle risorse umane o il team di formazione per discutere le tue esigenze specifiche.","assistant","2025-12-17 14:38:59.314","238"
"6931","46","user","Ho difficoltà a seguire i corsi online aziendali a causa del mio autismo. Ci sono alternative?","foo.presales@testing.org","2025-12-17 14:38:31.845","238"
"6930","46","assistant","Per cambiare il tuo nome nel sistema aziendale, ti consiglio di seguire questi passaggi:

- **Contatta le Risorse Umane**: Inizia contattando il dipartimento delle risorse umane per informarti sulla procedura specifica per aggiornare il tuo nome nei sistemi aziendali. Ogni azienda può avere un processo diverso.

- **Documentazione necessaria**: Chiedi se è necessaria qualche documentazione legale per effettuare il cambiamento. Alcune aziende potrebbero richiedere una copia del documento legale che attesta il cambio di nome.

- **Aggiornamento dei sistemi**: Una volta completata la documentazione, le risorse umane o il reparto IT dovrebbero essere in grado di aggiornare il tuo nome nei sistemi aziendali, inclusi email, badge identificativi e altri strumenti aziendali.

- **Comunicazione interna**: Se lo desideri, puoi chiedere supporto per comunicare il cambiamento ai tuoi colleghi, in modo che possano utilizzare il tuo nuovo nome.

- **Supporto e riservatezza**: Assicurati che il processo sia gestito con riservatezza e rispetto. Se hai bisogno di supporto aggiuntivo, non esitare a chiederlo.

Questi passaggi dovrebbero aiutarti a navigare il processo di cambio nome in modo più agevole.","assistant","2025-12-17 14:38:29.429","238"
"6929","46","user","Sto facendo la transizione e vorrei cambiare il mio nome nel sistema aziendale. Cosa devo fare?","foo.presales@testing.org","2025-12-17 14:38:19.018","238"
"6928","46","assistant","Rendere un annuncio di lavoro più inclusivo verso le persone LGBTQ+ è un ottimo passo per attrarre una forza lavoro diversificata. Ecco alcuni suggerimenti:

- **Usare un linguaggio neutro**: Evita termini di genere specifico e utilizza un linguaggio neutro per descrivere le posizioni e le responsabilità.

- **Includere una dichiarazione di inclusione**: Aggiungi una dichiarazione che sottolinei l'impegno dell'azienda per la diversità e l'inclusione, specificando che accogliete candidati di tutte le identità di genere e orientamenti sessuali.

- **Evidenziare i benefici inclusivi**: Se l'azienda offre benefici che supportano le persone LGBTQ+, come l'assicurazione sanitaria per partner dello stesso sesso o gruppi di risorse per dipendenti LGBTQ+, assicurati di menzionarli.

- **Rivedere i requisiti**: Assicurati che i requisiti del lavoro siano essenziali e non escludano involontariamente candidati diversi.

- **Promuovere un ambiente di lavoro inclusivo**: Descrivi le iniziative aziendali che promuovono un ambiente di lavoro inclusivo e accogliente.

- **Utilizzare immagini diversificate**: Se l'annuncio include immagini, assicurati che rappresentino una varietà di persone e identità.

Questi passi possono aiutare a creare un annuncio di lavoro che attragga una gamma più ampia di candidati e promuova un ambiente di lavoro inclusivo.","assistant","2025-12-17 14:38:16.015","238"
"6927","46","user","Come posso rendere un annuncio di lavoro più inclusivo verso le persone LGBTQ+?","foo.presales@testing.org","2025-12-17 14:38:07.869","238"
"6926","46","assistant","Non ho accesso diretto alle politiche specifiche sui permessi della tua azienda, ma generalmente, molte aziende offrono la possibilità di richiedere permessi personali o ferie per partecipare a eventi come la Parata del Pride. Ti consiglio di controllare le politiche aziendali relative ai permessi o di parlare con il tuo responsabile o il dipartimento delle risorse umane per capire le opzioni disponibili. Partecipare a eventi che supportano la diversità e l'inclusione è un modo positivo per contribuire a una cultura aziendale inclusiva.","assistant","2025-12-17 14:38:00.679","238"
"6925","46","user","Vorrei sapere se posso chiedere un permesso per andare alla Parata del Pride?","foo.presales@testing.org","2025-12-17 14:37:57.304","238"
"6924","46","assistant","Non ho accesso a documenti specifici riguardanti il dress code aziendale, ma in generale, molte aziende promuovono un ambiente di lavoro inclusivo dove i dipendenti possono esprimere la propria identità, inclusa la scelta dell'abbigliamento. Se non sei sicuro delle linee guida sul dress code, potrebbe essere utile consultare il manuale del dipendente o chiedere chiarimenti al tuo responsabile delle risorse umane. Indossare una maglietta con i colori dell'arcobaleno è un modo per esprimere il tuo supporto alla diversità e all'inclusione, e dovrebbe essere rispettato in un ambiente di lavoro inclusivo.","assistant","2025-12-17 14:37:47.511","238"
"6923","46","user","Indosso una maglietta con i colori dell'arcobaleno e ho ricevuto uno sguardo strano da un collega. È previsto un dress code?","foo.presales@testing.org","2025-12-17 14:37:43.229","238"
"6922","46","assistant","È importante affrontare commenti come questo con calma e apertura al dialogo. Ecco alcuni suggerimenti su come potresti rispondere:

- **Promuovere la consapevolezza**: Spiega che l'affidabilità sul lavoro non è determinata dall'orientamento sessuale, ma dalle competenze, dall'etica professionale e dall'impegno di una persona.

- **Fornire dati e ricerche**: Se possibile, condividi ricerche o dati che dimostrano come la diversità, inclusa la diversità di orientamento sessuale, possa portare a team più innovativi e produttivi.

- **Incoraggiare l'inclusione**: Sottolinea l'importanza di un ambiente di lavoro inclusivo, dove tutti i dipendenti si sentano rispettati e valorizzati per le loro capacità e contributi.

- **Offrire formazione**: Suggerisci l'opportunità di partecipare a programmi di formazione sulla diversità e l'inclusione per migliorare la comprensione e la collaborazione tra colleghi.

- **Condividere esperienze personali**: Se ti senti a tuo agio, condividi la tua esperienza personale per aiutare a umanizzare la discussione e promuovere l'empatia.

Ricorda che il dialogo aperto e rispettoso è fondamentale per promuovere un ambiente di lavoro positivo e inclusivo.","assistant","2025-12-17 14:37:38.473","238"
"6921","46","user","Una collega ha detto che le persone eterosessuali sono più affidabili sul lavoro. Come dovrei rispondere?","foo.presales@testing.org","2025-12-17 14:37:30.458","238"
"6920","46","assistant","Non ho esempi specifici di leadership transgender in azienda nei documenti a mia disposizione, ma posso suggerire alcune buone pratiche Client Xi che potrebbero essere utili per la tua presentazione:

- **Creare un ambiente inclusivo**: Promuovere una cultura aziendale che valorizzi la diversità e l'inclusione, assicurandosi che le politiche aziendali supportino le persone transgender in tutti gli aspetti del loro lavoro.

- **Formazione e sensibilizzazione**: Offrire programmi di formazione per aumentare la consapevolezza e la comprensione delle questioni transgender tra i dipendenti, inclusi i dirigenti.

- **Politiche di supporto**: Implementare politiche che supportino le persone transgender, come l'accesso a bagni e spogliatoi che corrispondono alla loro identità di genere, e garantire che i documenti aziendali riflettano il nome e il genere scelti.

- **Mentorship e sviluppo professionale**: Creare opportunità di mentorship e sviluppo professionale specificamente per le persone transgender, per aiutarle a crescere e avanzare nella loro carriera.

- **Visibilità e rappresentanza**: Promuovere la visibilità delle persone transgender in ruoli di leadership, condividendo storie di successo e creando modelli di ruolo positivi all'interno dell'azienda.

Se hai bisogno di ulteriori dettagli o di un supporto specifico, fammi sapere!","assistant","2025-12-17 14:37:20.645","238"
"6919","46","user","	Sto preparando una presentazione sulla leadership transgender in azienda. Hai esempi o buone pratiche da suggerire?","foo.presales@testing.org","2025-12-17 14:37:10.713","238"
"6918","46","assistant","Ciao Luca! È fantastico vedere come la tua esperienza e prospettiva unica contribuiscano a creare un ambiente di lavoro più inclusivo e accessibile. Il tuo ruolo come HR IT Liaison è cruciale per garantire che le piattaforme digitali siano non solo sicure e conformi, ma anche accessibili a tutti i dipendenti. Se hai bisogno di supporto o vuoi discutere di nuove soluzioni tecniche, sono qui per aiutarti. Fammi sapere come posso assisterti!","assistant","2025-12-17 14:36:55.924","238"
"6917","46","user","Ciao, sono Luca, ho 31 anni e ricopro il ruolo di HR IT Liaison all’interno della nostra realtà tecnologica. Sono un uomo transgender, gay, e vivo con una lieve forma di autismo diagnosticata da adulto, il che mi ha permesso di sviluppare una prospettiva unica su come strutturare processi e strumenti in modo realmente accessibile. Il mio background è quello di un laureato in informatica del Nord Italia, con cinque anni di esperienza in aziende tech dove ho affinato competenze avanzate nella gestione di sistemi, integrazioni software e automazione dei flussi HR. In qualità di ponte tra le risorse umane e il reparto IT, mi occupo di: Valutare e selezionare le piattaforme digitali più adatte per la gestione del personale, garantendo che siano conformi ai requisiti di sicurezza, privacy e usabilità. Implementare soluzioni di automazione per onboarding, gestione delle presenze e valutazioni delle performance, riducendo al minimo gli errori manuali e migliorando l’efficienza operativa. Assicurare l’accessibilità delle applicazioni HR per tutti i dipendenti, includendo funzionalità di supporto per neurodiversità (ad es. modalità a contrasto elevato, navigazione semplificata, personalizzazioni UI). Fornire supporto tecnico al team HR, traducendo esigenze operative in specifiche tecniche e coordinando gli sviluppatori per realizzare soluzioni su misura. Monitorare la conformità a normative di data protection (GDPR) e a policy interne di sicurezza, intervenendo prontamente in caso di vulnerabilità. Pur avendo un interesse medio per la diversità e l’inclusione, riconosco quanto sia cruciale che i nostri strumenti digitali non solo rispettino le normative, ma siano anche progettati tenendo conto delle varie identità di genere e delle diverse modalità cognitive dei nostri colleghi. Credo fermamente che un ambiente di lavoro veramente inclusivo parta da tecnologie che siano fruibili da chiunque, indipendentemente da genere, orientamento sessuale o neurodiversità. Sono sempre disponibile a discutere di nuove soluzioni tecniche, a condurre stress‑test sui sistemi HR e a collaborare con i team per garantire che le nostre piattaforme siano robuste, sicure e inclusive.","foo.presales@testing.org","2025-12-17 14:36:52.860","238"
