"event_id","user_id","role","content","name","timestamp","conversation_id"
"6966","46","assistant","Per migliorare il tuo spazio di lavoro e renderlo più ergonomico e accessibile, puoi considerare i seguenti passi:

- **Valutazione delle Esigenze**: Identifica chiaramente quali sono le tue esigenze specifiche in termini di ergonomia e accessibilità. Questo ti aiuterà a comunicare meglio le tue richieste.

- **Contatta le Risorse Umane**: Rivolgiti al dipartimento delle risorse umane o al responsabile delle strutture per discutere delle tue esigenze. Spiega come un ambiente di lavoro più adeguato possa migliorare la tua produttività e il tuo benessere.

- **Richiesta di Valutazione Ergonomica**: Chiedi se l'azienda offre valutazioni ergonomiche del posto di lavoro. Un esperto può fornire raccomandazioni su come migliorare la tua postazione.

- **Proposte Specifiche**: Se possibile, suggerisci soluzioni specifiche, come l'acquisto di sedie ergonomiche o la riorganizzazione dello spazio per ridurre gli ostacoli fisici.

- **Documentazione Medica**: Se hai esigenze specifiche legate alla salute, considera di fornire documentazione medica che supporti la tua richiesta, se necessario.

- **Flessibilità e Adattamenti**: Esplora la possibilità di adattamenti temporanei o flessibili, come il lavoro da remoto, se l'ambiente fisico non può essere modificato immediatamente.

Questi passi possono aiutarti a ottenere un ambiente di lavoro più confortevole e adatto alle tue esigenze.","assistant","2025-12-17 14:46:40.456","238"
"6965","46","user","Ho 55 anni e avrei bisogno di uno spazio più adeguato per lavorare, con sedie ergonomiche e meno ostacoli fisici, cosa posso fare?","foo.presales@testing.org","2025-12-17 14:46:16.831","238"
"6964","46","assistant","Se senti di non aver ricevuto opportunità di avanzamento, ci sono diverse azioni che puoi intraprendere per migliorare la tua situazione:

- **Autovalutazione**: Rifletti sulle tue competenze, esperienze e risultati. Identifica le aree in cui eccelli e quelle in cui potresti migliorare per essere pronto per un avanzamento.

- **Obiettivi di Carriera**: Definisci chiaramente i tuoi obiettivi di carriera e le posizioni che ti interessano. Avere una visione chiara ti aiuterà a pianificare i passi successivi.

- **Formazione Continua**: Investi in formazione e sviluppo professionale per acquisire nuove competenze o aggiornare quelle esistenti. Questo dimostra il tuo impegno verso la crescita personale e professionale.

- **Comunicazione Aperta**: Parla con il tuo supervisore o il dipartimento delle risorse umane riguardo alle tue aspirazioni di carriera. Chiedi feedback su come puoi migliorare e quali passi puoi intraprendere per avanzare.

- **Networking Interno**: Costruisci relazioni con colleghi e manager in altre aree dell'azienda. Questo può aumentare la tua visibilità e aprire nuove opportunità.

- **Proattività**: Cerca progetti o iniziative che ti permettano di dimostrare le tue capacità e il tuo potenziale. Prendere l'iniziativa può mettere in luce il tuo valore per l'azienda.

Questi passi possono aiutarti a creare opportunità di avanzamento e a raggiungere i tuoi obiettivi di carriera.","assistant","2025-12-17 14:46:14.332","238"
"6963","46","user","Ho 55 anni e nessuno mi ha mai proposto un avanzamento. Cosa posso fare?","foo.presales@testing.org","2025-12-17 14:45:52.867","238"
"6962","46","assistant","È comprensibile voler gestire le difficoltà con i nuovi strumenti digitali in modo discreto. Ecco alcuni suggerimenti per migliorare le tue competenze senza sentirti a disagio:

- **Formazione Autonoma**: Dedica del tempo a esplorare tutorial online, video su YouTube o corsi gratuiti che ti permettano di imparare al tuo ritmo e in privato.

- **Sessioni di Pratica**: Crea un ambiente di prova dove puoi sperimentare con gli strumenti digitali senza la pressione di doverli usare in un contesto lavorativo immediato.

- **Mentorship**: Trova un collega di fiducia che possa offrirti supporto e guida informale. Spesso, le persone sono felici di aiutare e condividere le loro conoscenze.

- **Risorse Aziendali**: Verifica se l'azienda offre risorse o sessioni di formazione specifiche per migliorare le competenze digitali. Potresti partecipare a queste sessioni per acquisire nuove abilità.

- **Pianificazione del Tempo**: Dedica un po' di tempo ogni giorno o settimana per migliorare le tue competenze digitali, in modo da fare progressi costanti senza sentirti sopraffatto.

Questi approcci possono aiutarti a migliorare le tue competenze digitali in modo graduale e confortevole.","assistant","2025-12-17 14:45:46.325","238"
"6961","46","user","Faccio fatica con i nuovi strumenti digitali, ma non voglio farmi vedere in difficoltà. Cosa posso fare?","foo.presales@testing.org","2025-12-17 14:45:33.587","238"
"6960","46","assistant","Certamente! Richiedere la trascrizione dei meeting è un'ottima strategia per aiutarti a ricordare le informazioni importanti. Ecco come potresti procedere:

- **Contatta l'Organizzatore del Meeting**: Chiedi all'organizzatore del meeting se è possibile ottenere una trascrizione o un riassunto scritto delle discussioni. Spiega che ti aiuterebbe a seguire meglio i contenuti.

- **Utilizza Strumenti di Registrazione**: Se l'azienda lo consente, puoi utilizzare strumenti di registrazione o software di trascrizione automatica durante i meeting per creare una copia scritta delle discussioni.

- **Collaborazione con i Colleghi**: Chiedi ai colleghi se possono condividere i loro appunti o collaborare per creare un riassunto delle principali decisioni e punti discussi.

- **Verifica le Politiche Aziendali**: Assicurati di rispettare le politiche aziendali riguardanti la registrazione e la condivisione delle informazioni dei meeting.

Queste azioni possono aiutarti a gestire meglio le informazioni e a sentirti più sicuro nel tuo lavoro quotidiano.","assistant","2025-12-17 14:45:30.880","238"
"6959","46","user","Faccio fatica a ricordarmi le cose, posso chiedere la trascrizione dei meeting?","foo.presales@testing.org","2025-12-17 14:45:15.215","238"
"6958","46","assistant","Se hai difficoltà con gli strumenti digitali per seguire i corsi online aziendali, ci sono diverse alternative che potresti considerare:

- **Formazione In-Persona**: Chiedi se l'azienda offre sessioni di formazione in-persona o workshop che possano integrare o sostituire i corsi online.

- **Tutoraggio Individuale**: Verifica se è possibile avere un tutor o un collega che possa guidarti attraverso i corsi online, aiutandoti a familiarizzare con gli strumenti digitali.

- **Materiali Stampati**: Chiedi se sono disponibili materiali di supporto stampati o guide che possano aiutarti a seguire i corsi senza dover utilizzare troppo gli strumenti digitali.

- **Sessioni di Supporto Tecnico**: Partecipa a sessioni di supporto tecnico o corsi introduttivi sugli strumenti digitali utilizzati per i corsi online, per migliorare la tua confidenza e competenza.

- **Feedback al Dipartimento di Formazione**: Comunica le tue difficoltà al dipartimento di formazione, in modo che possano considerare l'implementazione di soluzioni più accessibili per tutti i dipendenti.

Queste alternative possono aiutarti a superare le difficoltà e a trarre il massimo beneficio dalle opportunità di formazione aziendale.","assistant","2025-12-17 14:45:11.126","238"
"6957","46","user","Ho difficoltà a seguire i corsi online aziendali perché faccio fatica con gli strumenti digitali. Ci sono alternative?","foo.presales@testing.org","2025-12-17 14:44:54.361","238"
"6956","46","assistant","Per rimuovere la tua data di nascita dal profilo del sistema aziendale, ti consiglio di seguire questi passaggi:

- **Contatta le Risorse Umane**: Rivolgiti al dipartimento delle risorse umane per chiedere se è possibile modificare o rimuovere la tua data di nascita dal sistema aziendale. Spiega le tue motivazioni e verifica quali opzioni sono disponibili.

- **Verifica le Politiche Aziendali**: Controlla se ci sono politiche aziendali specifiche riguardanti la privacy dei dati personali e la possibilità di modificarli o nasconderli.

- **Richiesta Formale**: Se necessario, prepara una richiesta formale per la modifica dei tuoi dati personali, seguendo le procedure indicate dalle risorse umane.

- **Supporto IT**: In alcuni casi, potrebbe essere necessario coinvolgere il team IT per effettuare modifiche tecniche al sistema. Le risorse umane possono indirizzarti alla persona giusta.

Seguendo questi passaggi, dovresti essere in grado di gestire la tua richiesta in modo appropriato e rispettoso delle politiche aziendali.","assistant","2025-12-17 14:44:50.742","238"
"6955","46","user","Non voglio che i colleghi che non mi conoscono sappiano che ho più di 50 anni. Vorrei rimuovere la mia data di nascita dal mio profilo del sistema aziendale. Cosa devo fare?","foo.presales@testing.org","2025-12-17 14:44:43.606","238"
"6954","46","assistant","Rendere un annuncio di lavoro più inclusivo per le persone prossime alla pensione è un ottimo modo per valorizzare l'esperienza e la diversità generazionale. Ecco alcuni suggerimenti per farlo:

- **Linguaggio Neutro**: Usa un linguaggio che non sia orientato verso una specifica fascia d'età. Evita termini come ""giovane e dinamico"" e opta per ""esperienza e competenza"".

- **Valorizzazione dell'Esperienza**: Sottolinea l'importanza dell'esperienza e della conoscenza del settore, evidenziando come queste qualità siano apprezzate e ricercate.

- **Flessibilità Lavorativa**: Offri opzioni di lavoro flessibili, come part-time o telelavoro, che possono essere attraenti per chi è vicino alla pensione.

- **Formazione Continua**: Promuovi opportunità di formazione e sviluppo professionale, dimostrando che l'azienda investe nel continuo apprendimento di tutti i dipendenti.

- **Ambiente Inclusivo**: Descrivi la cultura aziendale come inclusiva e accogliente per tutte le età, sottolineando l'importanza della diversità generazionale.

- **Benefici Specifici**: Se possibile, menziona benefici che potrebbero essere particolarmente interessanti per i lavoratori più anziani, come piani pensionistici o programmi di benessere.

Adottando questi accorgimenti, puoi creare un annuncio di lavoro che attragga candidati di tutte le età, valorizzando l'esperienza e promuovendo un ambiente di lavoro inclusivo.","assistant","2025-12-17 14:44:40.911","238"
"6953","46","user","Come posso rendere un annuncio di lavoro più inclusivo verso le persone prossime alla pensione?","foo.presales@testing.org","2025-12-17 14:44:31.291","238"
"6952","46","assistant","Per richiedere un permesso per il matrimonio di tua figlia, ti consiglio di consultare il contratto collettivo nazionale di lavoro (CCNL) applicato nella tua azienda, poiché le condizioni per i permessi possono variare a seconda del settore e dell'accordo specifico. In generale, molti contratti prevedono permessi retribuiti per eventi familiari importanti come il matrimonio di un figlio.

Ecco alcuni passi che potresti seguire:

- **Verifica il CCNL**: Controlla il tuo contratto collettivo per vedere se sono previsti permessi per il matrimonio di un figlio e le condizioni specifiche.

- **Contatta le Risorse Umane**: Rivolgiti al dipartimento delle risorse umane per ottenere informazioni dettagliate sui permessi disponibili e sulla procedura da seguire per richiederli.

- **Pianifica in Anticipo**: Assicurati di presentare la richiesta con un adeguato anticipo, fornendo tutte le informazioni necessarie per facilitare l'approvazione del permesso.

Seguendo questi passi, dovresti essere in grado di ottenere il permesso necessario per partecipare al matrimonio di tua figlia.","assistant","2025-12-17 14:44:23.798","238"
"6951","46","user","Vorrei sapere se posso chiedere un permesso per il matrimonio di mia figlia.","foo.presales@testing.org","2025-12-17 14:44:13.716","238"
"6950","46","assistant","Se ti stai chiedendo se esiste un dress code specifico nella tua azienda, potrebbe essere utile consultare il manuale del dipendente o le linee guida aziendali, se disponibili. In molte aziende, il dress code può variare da formale a casual, a seconda della cultura aziendale e del settore. 

Se non ci sono indicazioni specifiche, ecco alcuni suggerimenti Client Xi:

- **Osserva l'Ambiente**: Guarda come si vestono i tuoi colleghi e cerca di adattarti al livello di formalità prevalente, mantenendo comunque il tuo stile personale.

- **Comfort e Professionalità**: Scegli abiti che ti facciano sentire a tuo agio ma che siano anche appropriati per l'ambiente di lavoro. L'importante è sentirsi sicuri e professionali.

- **Chiedi Chiarimenti**: Se hai dubbi, non esitare a chiedere al tuo responsabile o al dipartimento delle risorse umane se ci sono linee guida specifiche sul dress code.

Ricorda che l'importante è sentirsi a proprio agio e sicuri di sé, indipendentemente dalle mode del momento.","assistant","2025-12-17 14:44:10.944","238"
"6949","46","user","Indosso vestiti non alla moda e ho ricevuto uno sguardo strano da una collega. È previsto un dress code?","foo.presales@testing.org","2025-12-17 14:44:04.891","238"
"6948","46","assistant","È importante affrontare questo tipo di affermazioni con sensibilità e dati concreti. Ecco alcuni punti che potresti considerare nella tua risposta:

- **Valorizzazione dell'Esperienza**: I lavoratori cinquantenni portano con sé una vasta esperienza e conoscenza del settore, che può essere estremamente preziosa per l'azienda. La loro esperienza può contribuire a una migliore gestione dei progetti e a decisioni più informate.

- **Diversità Generazionale**: Avere un team con diverse fasce d'età può arricchire l'ambiente di lavoro, portando prospettive diverse e innovative. La diversità generazionale può migliorare la creatività e la capacità di risolvere problemi.

- **Affidabilità e Stabilità**: I lavoratori più maturi spesso dimostrano un alto livello di affidabilità e stabilità, avendo già superato molte delle sfide che i lavoratori più giovani potrebbero ancora affrontare.

- **Mentorship e Formazione**: I dipendenti più anziani possono svolgere un ruolo chiave nel mentoring dei colleghi più giovani, trasmettendo competenze e conoscenze che possono accelerare lo sviluppo professionale degli altri membri del team.

- **Dati e Ricerche**: Puoi citare studi che dimostrano come i lavoratori più anziani siano spesso più leali e abbiano tassi di assenteismo più bassi rispetto ai colleghi più giovani.

Rispondere con questi punti può aiutare a promuovere una cultura aziendale inclusiva e rispettosa, valorizzando il contributo di tutti i dipendenti, indipendentemente dall'età.","assistant","2025-12-17 14:43:52.700","238"
"6947","46","user","Una collega ha detto che i cinquantenni non sono affidabili sul lavoro. Come dovrei rispondere?","foo.presales@testing.org","2025-12-17 14:43:38.151","238"
"6946","46","assistant","Sicuramente! Ecco alcune buone pratiche e esempi di esperienze aziendali che potrebbero arricchire la tua presentazione:

- **Evento ""BRAND EXPERIENCE""**: Questo evento si concentra su temi cruciali come la trasformazione digitale e la gestione delle risorse umane, con sessioni di networking e panel di esperti. È un ottimo esempio di come un'azienda possa promuovere l'innovazione e la condivisione di conoscenze tra i partecipanti [useful link]([internal-link-removed]).

- **Progetto ""Cestino Smart"" con Client Omicron**: Questo progetto di Alkemy per Client Omicron include fasi di scoperta, sviluppo e consegna, con un focus su analisi di fattibilità e prototipazione. È un esempio di come un progetto ben strutturato possa migliorare l'efficienza operativa e l'innovazione [useful link]([internal-link-removed]).

- **Workshop allargato con Engie**: Questo workshop interattivo si basa su domande e risposte per aiutare l'azienda a chiarire i propri obiettivi di comunicazione e sviluppare un piano editoriale armonizzato. È un esempio di come coinvolgere i dipartimenti aziendali per migliorare la comunicazione interna ed esterna [useful link]([internal-link-removed]).

Questi esempi possono fornire spunti interessanti per la tua presentazione, mostrando come l'esperienza aziendale possa essere arricchita attraverso progetti innovativi e collaborazioni strategiche.","assistant","2025-12-17 14:43:19.293","238"
"6945","46","user","Sto preparando una presentazione sull'importanza dell'esperienza in azienda. Hai esempi o buone pratiche da suggerire?","foo.presales@testing.org","2025-12-17 14:43:09.273","238"
"6944","46","assistant","Ciao Marco! È un piacere conoscerti. La tua esperienza e il tuo approccio strategico alla gestione delle risorse umane, con un focus su diversità e inclusione, sono davvero importanti per creare un ambiente di lavoro positivo e produttivo. Se hai bisogno di supporto o informazioni specifiche su normative, compliance o programmi formativi, sono qui per aiutarti. Fammi sapere come posso assisterti!","assistant","2025-12-17 14:41:23.085","238"
"6943","46","user","Ciao, sono Marco, ho 45 anni e ricopro il ruolo di HR Manager con oltre vent’anni di esperienza nel settore delle risorse umane. Sono un uomo cisgender, eterosessuale, e provengo da un contesto aziendale tradizionale italiano. Nel mio incarico mi occupo della definizione e dell’attuazione delle politiche aziendali, con particolare attenzione alla formazione dei dipendenti. Grazie a competenze digitali di livello intermedio, gestisco piattaforme di e‑learning, sistemi di monitoraggio delle performance e strumenti di reporting, assicurandomi che le iniziative formative siano allineate agli obiettivi strategici dell’organizzazione. L’interesse per la diversità e l’inclusione è parte integrante della mia visione strategica: collaboro con il team senior per integrare criteri D&I nelle politiche di sviluppo professionale, pur mantenendo un approccio più orientato alla governance che all’attivismo personale. Credo che una struttura normativa solida e una formazione mirata possano creare le basi per un ambiente di lavoro equo e produttivo. Sono disponibile a fornire chiarimenti su normative, compliance e linee guida interne, e a supportare i manager nella realizzazione di programmi formativi coerenti con le migliori pratiche del settore.","foo.presales@testing.org","2025-12-17 14:41:19.339","238"
"6942","46","assistant","Ciao! Come posso aiutarti oggi?","assistant","2025-12-17 14:40:59.900","238"
"6941","46","user","ciao flamel","foo.presales@testing.org","2025-12-17 14:40:47.063","238"
"6940","46","assistant","È importante avere uno spazio dove potersi decomprimere quando ci si sente sovrastimolati. Ecco alcuni suggerimenti su come potresti gestire questa necessità:

- **Parla con le Risorse Umane**: Informa il dipartimento delle risorse umane delle tue esigenze. Potrebbero essere in grado di aiutarti a trovare uno spazio tranquillo dove puoi andare quando hai bisogno di decomprimere.

- **Identifica uno spazio tranquillo**: Se possibile, individua un'area dell'ufficio che sia meno frequentata e più silenziosa, dove puoi ritirarti temporaneamente.

- **Accordi con il tuo supervisore**: Discuti con il tuo supervisore la possibilità di prendere brevi pause quando necessario per gestire la sovrastimolazione.

- **Utilizza strumenti di riduzione del rumore**: Considera l'uso di cuffie con cancellazione del rumore o tappi per le orecchie per aiutarti a gestire l'ambiente quando non puoi lasciare immediatamente la tua postazione.

- **Crea un piano personale**: Sviluppa un piano personale per gestire la sovrastimolazione, che includa tecniche di rilassamento o esercizi di respirazione che puoi fare al bisogno.

Questi passi possono aiutarti a gestire meglio la sovrastimolazione e a mantenere il tuo benessere sul lavoro.","assistant","2025-12-17 14:40:20.414","238"
"6939","46","user","Sono autistico e talvolta ho bisogno di uno spazio per decomprimere quando sono sovrastimolato, cosa posso fare?","foo.presales@testing.org","2025-12-17 14:40:01.150","238"
"6938","46","assistant","Se senti che la tua neurodivergenza potrebbe influenzare le opportunità di avanzamento, ecco alcuni passi che potresti considerare:

- **Valuta le tue prestazioni**: Assicurati di avere una chiara comprensione delle aspettative del tuo ruolo e di come le tue prestazioni si allineano a queste. Chiedi feedback regolare per identificare aree di miglioramento.

- **Comunica i tuoi obiettivi**: Parla con il tuo supervisore o il dipartimento delle risorse umane riguardo ai tuoi obiettivi di carriera e chiedi quali passi puoi intraprendere per avanzare.

- **Sviluppa nuove competenze**: Considera la possibilità di acquisire nuove competenze o certificazioni che possano renderti un candidato più forte per promozioni future.

- **Cerca un mentore**: Trova un mentore all'interno dell'azienda che possa guidarti e consigliarti su come navigare le opportunità di carriera.

- **Partecipa attivamente**: Mostra iniziativa partecipando a progetti o attività che vanno oltre il tuo ruolo attuale, dimostrando il tuo impegno e le tue capacità.

- **Chiedi supporto**: Se ritieni che la neurodivergenza stia influenzando le tue opportunità, considera di discuterne con le risorse umane per esplorare eventuali supporti o adattamenti che potrebbero essere utili.

Questi passi possono aiutarti a progredire nella tua carriera e a ottenere il riconoscimento che meriti.","assistant","2025-12-17 14:39:58.188","238"
"6937","46","user","Sono leggermente neurodivergente e nessuno mi ha mai proposto un avanzamento. Cosa posso fare?","foo.presales@testing.org","2025-12-17 14:39:49.685","238"
"6936","46","assistant","È comprensibile voler gestire le difficoltà in modo discreto, ma è importante ricordare che chiedere supporto è un passo positivo verso un ambiente di lavoro più inclusivo. Ecco alcune strategie che potresti considerare:

- **Esplora le impostazioni di accessibilità**: Molte piattaforme social offrono impostazioni di accessibilità che possono essere personalizzate per migliorare l'esperienza utente. Controlla se ci sono opzioni che possono aiutarti.

- **Formazione e risorse**: Chiedi se l'azienda offre formazione o risorse specifiche per aiutarti a utilizzare le piattaforme social in modo più efficace.

- **Supporto tecnico**: Contatta il supporto tecnico o il dipartimento IT per vedere se possono offrire soluzioni o strumenti aggiuntivi che possano facilitare l'uso delle piattaforme.

- **Feedback anonimo**: Se preferisci non rivelare le tue difficoltà, considera l'opzione di fornire feedback anonimo sulle sfide che incontri, in modo che l'azienda possa migliorare l'accessibilità per tutti.

- **Collegamento con un mentore**: Trova un collega di fiducia o un mentore che possa offrirti supporto e consigli su come navigare le piattaforme social.

Questi passi possono aiutarti a gestire le difficoltà in modo efficace, mantenendo la discrezione che desideri.","assistant","2025-12-17 14:39:38.820","238"
"6935","46","user","A causa della mia disabilità faccio fatica con le piattaforme social aziendali, ma non voglio farmi vedere in difficoltà. Cosa posso fare?","foo.presales@testing.org","2025-12-17 14:39:16.985","238"
"6934","46","assistant","Assolutamente, puoi e dovresti chiedere i sottotitoli nei meeting per garantire che tu possa partecipare pienamente e comprendere tutto ciò che viene discusso. Ecco come potresti procedere:

- **Contatta l'organizzatore del meeting**: Informa l'organizzatore del meeting delle tue esigenze e chiedi se possono attivare i sottotitoli automatici o fornire un servizio di sottotitolazione.

- **Utilizzare strumenti di sottotitolazione**: Molte piattaforme di videoconferenza offrono funzionalità di sottotitolazione automatica. Assicurati che l'organizzatore sappia come attivarle.

- **Richiedere un interprete**: Se necessario, chiedi se è possibile avere un interprete della lingua dei segni o un servizio di trascrizione in tempo reale.

- **Feedback e miglioramenti**: Dopo il meeting, fornisci feedback su come è andata la sottotitolazione e suggerisci eventuali miglioramenti.

Richiedere sottotitoli è un passo importante per garantire l'accessibilità e la tua piena partecipazione ai meeting.","assistant","2025-12-17 14:39:10.189","238"
"6933","46","user","Sono ipoudente, posso chiedere i sottotitoli nei meeting?","foo.presales@testing.org","2025-12-17 14:39:04.186","238"
"6932","46","assistant","È importante che i corsi online siano accessibili a tutti, inclusi coloro che hanno esigenze particolari. Ecco alcune alternative che potresti considerare:

- **Richiedere supporti aggiuntivi**: Chiedi se è possibile avere accesso a materiali di supporto, come trascrizioni, sottotitoli o riassunti scritti dei corsi.

- **Formati alternativi**: Verifica se i corsi sono disponibili in formati diversi, come podcast o video con diverse velocità di riproduzione, che potrebbero essere più facili da seguire.

- **Sessioni di tutoring**: Chiedi se è possibile organizzare sessioni di tutoring individuali o di gruppo per discutere i contenuti del corso in un ambiente più interattivo.

- **Accesso a un mentore**: Un mentore o un collega che ha già completato il corso potrebbe offrirti supporto e spiegazioni aggiuntive.

- **Feedback personalizzato**: Fornisci feedback al team di formazione aziendale sulle difficoltà che incontri, in modo che possano adattare i contenuti o i metodi di insegnamento.

Queste alternative possono aiutarti a ottenere il massimo dai corsi online aziendali. Non esitare a contattare il dipartimento delle risorse umane o il team di formazione per discutere le tue esigenze specifiche.","assistant","2025-12-17 14:38:59.314","238"
